{"schema_version":"semantic-rubric-result/1.0.0","eval_id":"rreh-hardening-ablation-eval-insufficient-cio-only-v3-20260908","grader":{"agent":"dev_eval","model":"gpt-5.6-terra","prompt_hash":"937f77555a8f4f251de353019cc52b3e7e58fc532a16b2013f0f62a250edd4de","rubric_hash":"8c4e0b1233b26f8799e9e083070945b936781b528a56f6dd2da3cc5cf409131f","input_hash":"c1ef17eacccc5c7f9c4b8f488870637c34c276456ddd0004fbd77a587440862b"},"dimensions":{"no_trade_reasoning":{"status":"PASS","grade":3,"evidence_refs":["ev-insufficient-price"],"rationale":"The sole permitted price observation and absent validated specialist reports support INSUFFICIENT_EVIDENCE; concrete re-evaluation conditions are stated."},"analyst_thesis_grounding":{"status":"NOT_APPLICABLE","grade":null,"evidence_refs":[],"rationale":"No analyst report is present in the frozen CIO-only artifacts."},"skeptic_counter_evidence":{"status":"NOT_APPLICABLE","grade":null,"evidence_refs":[],"rationale":"No skeptic report is present in the frozen CIO-only artifacts."},"cio_conflict_handling":{"status":"PASS","grade":3,"evidence_refs":["ev-insufficient-price"],"rationale":"CIO records no specialist consensus or conflicts, identifies missing specialist reports and unresolved questions, and reflects that limitation in NO_TRADE."},"confidence_calibration":{"status":"PASS","grade":3,"evidence_refs":["ev-insufficient-price"],"rationale":"Confidence 0.1 is explicitly tied to the single permitted observation and absence of validated specialist reports."}},"output_hash":"3aa9562763d1f6667500107d380abe9df132e15e5d3e8fa8e48e936f4867de1f"}
