{"dimensions":{"analyst_thesis_grounding":{"evidence_refs":["ev-normal-revenue","ev-normal-margin","ev-normal-debt","ev-normal-update"],"grade":3,"rationale":"Analyst 将收入、利润率、债务和管理层更新作为带引用的事实；解释性结论显式受 a1 假设及现金流、需求和估值缺口限制。","status":"PASS"},"cio_conflict_handling":{"evidence_refs":["ev-normal-debt","ev-normal-margin","ev-normal-revenue","ev-normal-update"],"grade":2,"rationale":"CIO 记录已验证 Analyst 报告的一致点、无冲突、具体未决问题及其对 NO_TRADE 的影响；该拓扑未提供独立 Skeptic 报告。","status":"PASS"},"confidence_calibration":{"evidence_refs":["ev-normal-debt","ev-normal-margin","ev-normal-revenue","ev-normal-update"],"grade":2,"rationale":"Analyst 与 CIO 均将置信度限定于已核验的经营和杠杆观察，并将流动性、现金流、需求、执行和估值缺口作为不确定性限制。","status":"PASS"},"no_trade_reasoning":{"evidence_refs":["ev-normal-debt","ev-normal-margin","ev-normal-revenue","ev-normal-update"],"grade":3,"rationale":"NO_TRADE 明确对应已核验事实的有限覆盖及流动性、现金流、趋势、需求、产能回报和估值缺口，并列出可核验的重评条件。","status":"PASS"},"skeptic_counter_evidence":{"evidence_refs":[],"grade":null,"rationale":"冻结输入未包含 Skeptic 运行产物；该 ablation 拓扑中无法评估独立反证质量。","status":"NOT_APPLICABLE"}},"eval_id":"rreh-ablation-v3-eval-normal-analyst-cio-20260907","grader":{"agent":"dev_eval","input_hash":"b8aa99ac9162952b7180df6f710de1918e555681af5d3a6b4f757900fcb637ac","model":"gpt-5.6-terra","prompt_hash":"937f77555a8f4f251de353019cc52b3e7e58fc532a16b2013f0f62a250edd4de","rubric_hash":"8c4e0b1233b26f8799e9e083070945b936781b528a56f6dd2da3cc5cf409131f"},"output_hash":"b4ca4e62d2e7c4542f911d69477703d4250bfda7c14f7c9058ffb1873bb657b0","schema_version":"semantic-rubric-result/1.0.0"}
