{
  "dimensions": {
    "analyst_thesis_grounding": {
      "evidence_refs": [
        "ev-risk-price",
        "ev-risk-revenue"
      ],
      "grade": 3,
      "rationale": "Analyst 将两项主张限定为有引用的价格和 TTM 收入事实，并明确区分其余商业质量、估值和风险判断所需的证据缺口。",
      "status": "PASS"
    },
    "cio_conflict_handling": {
      "evidence_refs": [
        "ev-risk-price",
        "ev-risk-revenue"
      ],
      "grade": 3,
      "rationale": "CIO 明确记录两份报告的共识、无机械证据冲突及未决问题，并将其影响限定为不形成方向性建议；最终 Risk Veto 亦被保留。",
      "status": "PASS"
    },
    "confidence_calibration": {
      "evidence_refs": [
        "ev-risk-price",
        "ev-risk-revenue"
      ],
      "grade": 3,
      "rationale": "Analyst 的低置信度对应证据不足；Skeptic 与 CIO 的较高置信度均明确限定为对证据不足结论的置信度，而非对证券基本面的方向性判断。",
      "status": "PASS"
    },
    "no_trade_reasoning": {
      "evidence_refs": [
        "ev-risk-price",
        "ev-risk-revenue"
      ],
      "grade": 3,
      "rationale": "最终决策明确由 Risk Engine 的 RISK_VETO 触发 NO_TRADE，并列出可行边界后重评条件；CIO 的证据不足理由亦与冻结证据范围一致。",
      "status": "PASS"
    },
    "skeptic_counter_evidence": {
      "evidence_refs": [
        "ev-risk-price",
        "ev-risk-revenue"
      ],
      "grade": 3,
      "rationale": "Independent First Pass 针对单点价格和单期收入提出具体、可证伪的限制，并列明解决各限制所需的冻结证据。",
      "status": "PASS"
    }
  },
  "eval_id": "rreh-hardening-regression-eval-execution-replay-risk-veto-20260908",
  "grader": {
    "agent": "dev_eval",
    "input_hash": "db9a57af869e666e6b2485ea89b896cc06befcc08622645fbdb32f0c2903da63",
    "model": "gpt-5.6-terra",
    "prompt_hash": "937f77555a8f4f251de353019cc52b3e7e58fc532a16b2013f0f62a250edd4de",
    "rubric_hash": "8c4e0b1233b26f8799e9e083070945b936781b528a56f6dd2da3cc5cf409131f"
  },
  "output_hash": "790771e2214362237c9074a2a89e4a83302532d7421e847d7d09df21d6801af7",
  "schema_version": "semantic-rubric-result/1.0.0"
}
